{"fixture_format":"determa.timer_helper.delivery_vectors","fixture_schema_version":1,"invalid_vectors":[],"vectors":[{"after":{"bindings":[{"admission_binding_digest":"sha256:0acd3e2dc158c89de9ed8c4c004ec06e479b923fed31ac797cb1aaa0beb0869c","delivery_message_kind":"admission_binding","envelope_digest":"sha256:090d185fdbd7c983105c96e8b5b3577dfdb6411e19e4bb3fe599f8e5dee0b848","event_id":"sha256:b123d06f368bd889fc71cfa8d1d1fce701a274740477aeef162c2b636a65bd62","evidence":{"acceptance_sequence":"0","checkpoint":{"checkpoint_revision":"1","execution_checkpoint_digest":"sha256:9c466cd1fe4f0ead8151223fc33d7857562e20fbec40c18d9bb2f3b814b07b3a","root_instance_id":"server-1"},"envelope_digest":"sha256:090d185fdbd7c983105c96e8b5b3577dfdb6411e19e4bb3fe599f8e5dee0b848","operation_kind":"acceptance","receipt_sequence":"1"},"source_content_digest":"sha256:cb15ec2440b30586457441b0063e75d398569baaef6e116795d4e55065ed1002","source_delivery_id":"sha256:6b26c4b86994eafbce3d764c8468ded9af0595de8119a6ba140605cf8480abf1","source_scope":"effect-scope-1"}],"checkpoint":"after-timer-checkpoint-v1.json","dead_letters":[],"provider_dispatches":0,"source_acknowledgements":[{"source_delivery_id":"sha256:6b26c4b86994eafbce3d764c8468ded9af0595de8119a6ba140605cf8480abf1","source_scope":"effect-scope-1"}]},"before":{"bindings":[],"checkpoint":"before-timer-checkpoint-v1.json","dead_letters":[],"provider_dispatches":0,"source_acknowledgements":[]},"expected_response":{"acknowledge_source":true,"admission_binding_digest":"sha256:0acd3e2dc158c89de9ed8c4c004ec06e479b923fed31ac797cb1aaa0beb0869c","decision_authority":{"identifier":"orders-host","kind":"host_profile"},"delivery_message_kind":"admitted","event_id":"sha256:b123d06f368bd889fc71cfa8d1d1fce701a274740477aeef162c2b636a65bd62","evidence":{"acceptance_sequence":"0","checkpoint":{"checkpoint_revision":"1","execution_checkpoint_digest":"sha256:9c466cd1fe4f0ead8151223fc33d7857562e20fbec40c18d9bb2f3b814b07b3a","root_instance_id":"server-1"},"envelope_digest":"sha256:090d185fdbd7c983105c96e8b5b3577dfdb6411e19e4bb3fe599f8e5dee0b848","operation_kind":"acceptance","receipt_sequence":"1"},"retention":{"minimum_replay_until":null,"profile":"permanent"},"source_content_digest":"sha256:cb15ec2440b30586457441b0063e75d398569baaef6e116795d4e55065ed1002","source_delivery_id":"sha256:6b26c4b86994eafbce3d764c8468ded9af0595de8119a6ba140605cf8480abf1","source_scope":"effect-scope-1"},"fault_injection":null,"name":"timer_first_committed_admission","operation":"ingest","replay_of":null,"request":{"delivery_message_kind":"ingress_request","delivery_mode":"input","envelope":{"cause_id":"sha256:b123d06f368bd889fc71cfa8d1d1fce701a274740477aeef162c2b636a65bd62","event":"received","event_id":"sha256:b123d06f368bd889fc71cfa8d1d1fce701a274740477aeef162c2b636a65bd62","payload":["map",[]],"source":{"host":true},"target":{"root":{"root_instance_id":"server-1","root_runtime_id":"sha256:9b0e3238e782cb7d912febc1acc4e4c03a121d201764d0bc9658b969feac4dc8"}}},"source":{"content":{"content_kind":"canonical_transport_value","content_value":["map",[["cause_id",["string","sha256:b123d06f368bd889fc71cfa8d1d1fce701a274740477aeef162c2b636a65bd62"]],["event",["string","received"]],["event_id",["string","sha256:b123d06f368bd889fc71cfa8d1d1fce701a274740477aeef162c2b636a65bd62"]],["payload",["list",[["string","map"],["list",[]]]]],["source",["map",[["host",["boolean",true]]]]],["target",["map",[["root",["map",[["root_instance_id",["string","server-1"]],["root_runtime_id",["string","sha256:9b0e3238e782cb7d912febc1acc4e4c03a121d201764d0bc9658b969feac4dc8"]]]]]]]]]]},"source_content_digest":"sha256:cb15ec2440b30586457441b0063e75d398569baaef6e116795d4e55065ed1002","source_delivery_id":"sha256:6b26c4b86994eafbce3d764c8468ded9af0595de8119a6ba140605cf8480abf1","source_scope":"effect-scope-1"}}},{"after":{"bindings":[{"admission_binding_digest":"sha256:0acd3e2dc158c89de9ed8c4c004ec06e479b923fed31ac797cb1aaa0beb0869c","delivery_message_kind":"admission_binding","envelope_digest":"sha256:090d185fdbd7c983105c96e8b5b3577dfdb6411e19e4bb3fe599f8e5dee0b848","event_id":"sha256:b123d06f368bd889fc71cfa8d1d1fce701a274740477aeef162c2b636a65bd62","evidence":{"acceptance_sequence":"0","checkpoint":{"checkpoint_revision":"1","execution_checkpoint_digest":"sha256:9c466cd1fe4f0ead8151223fc33d7857562e20fbec40c18d9bb2f3b814b07b3a","root_instance_id":"server-1"},"envelope_digest":"sha256:090d185fdbd7c983105c96e8b5b3577dfdb6411e19e4bb3fe599f8e5dee0b848","operation_kind":"acceptance","receipt_sequence":"1"},"source_content_digest":"sha256:cb15ec2440b30586457441b0063e75d398569baaef6e116795d4e55065ed1002","source_delivery_id":"sha256:6b26c4b86994eafbce3d764c8468ded9af0595de8119a6ba140605cf8480abf1","source_scope":"effect-scope-1"}],"checkpoint":"after-timer-checkpoint-v1.json","dead_letters":[],"provider_dispatches":0,"source_acknowledgements":[]},"before":{"bindings":[],"checkpoint":"before-timer-checkpoint-v1.json","dead_letters":[],"provider_dispatches":0,"source_acknowledgements":[]},"expected_response":{"kind":"no_response"},"fault_injection":"crash_after_commit_before_ack","name":"timer_crash_after_commit_before_ack","operation":"ingest","replay_of":null,"request":{"delivery_message_kind":"ingress_request","delivery_mode":"input","envelope":{"cause_id":"sha256:b123d06f368bd889fc71cfa8d1d1fce701a274740477aeef162c2b636a65bd62","event":"received","event_id":"sha256:b123d06f368bd889fc71cfa8d1d1fce701a274740477aeef162c2b636a65bd62","payload":["map",[]],"source":{"host":true},"target":{"root":{"root_instance_id":"server-1","root_runtime_id":"sha256:9b0e3238e782cb7d912febc1acc4e4c03a121d201764d0bc9658b969feac4dc8"}}},"source":{"content":{"content_kind":"canonical_transport_value","content_value":["map",[["cause_id",["string","sha256:b123d06f368bd889fc71cfa8d1d1fce701a274740477aeef162c2b636a65bd62"]],["event",["string","received"]],["event_id",["string","sha256:b123d06f368bd889fc71cfa8d1d1fce701a274740477aeef162c2b636a65bd62"]],["payload",["list",[["string","map"],["list",[]]]]],["source",["map",[["host",["boolean",true]]]]],["target",["map",[["root",["map",[["root_instance_id",["string","server-1"]],["root_runtime_id",["string","sha256:9b0e3238e782cb7d912febc1acc4e4c03a121d201764d0bc9658b969feac4dc8"]]]]]]]]]]},"source_content_digest":"sha256:cb15ec2440b30586457441b0063e75d398569baaef6e116795d4e55065ed1002","source_delivery_id":"sha256:6b26c4b86994eafbce3d764c8468ded9af0595de8119a6ba140605cf8480abf1","source_scope":"effect-scope-1"}}},{"after":{"bindings":[{"admission_binding_digest":"sha256:0acd3e2dc158c89de9ed8c4c004ec06e479b923fed31ac797cb1aaa0beb0869c","delivery_message_kind":"admission_binding","envelope_digest":"sha256:090d185fdbd7c983105c96e8b5b3577dfdb6411e19e4bb3fe599f8e5dee0b848","event_id":"sha256:b123d06f368bd889fc71cfa8d1d1fce701a274740477aeef162c2b636a65bd62","evidence":{"acceptance_sequence":"0","checkpoint":{"checkpoint_revision":"1","execution_checkpoint_digest":"sha256:9c466cd1fe4f0ead8151223fc33d7857562e20fbec40c18d9bb2f3b814b07b3a","root_instance_id":"server-1"},"envelope_digest":"sha256:090d185fdbd7c983105c96e8b5b3577dfdb6411e19e4bb3fe599f8e5dee0b848","operation_kind":"acceptance","receipt_sequence":"1"},"source_content_digest":"sha256:cb15ec2440b30586457441b0063e75d398569baaef6e116795d4e55065ed1002","source_delivery_id":"sha256:6b26c4b86994eafbce3d764c8468ded9af0595de8119a6ba140605cf8480abf1","source_scope":"effect-scope-1"}],"checkpoint":"after-timer-checkpoint-v1.json","dead_letters":[],"provider_dispatches":0,"source_acknowledgements":[{"source_delivery_id":"sha256:6b26c4b86994eafbce3d764c8468ded9af0595de8119a6ba140605cf8480abf1","source_scope":"effect-scope-1"}]},"before":{"bindings":[{"admission_binding_digest":"sha256:0acd3e2dc158c89de9ed8c4c004ec06e479b923fed31ac797cb1aaa0beb0869c","delivery_message_kind":"admission_binding","envelope_digest":"sha256:090d185fdbd7c983105c96e8b5b3577dfdb6411e19e4bb3fe599f8e5dee0b848","event_id":"sha256:b123d06f368bd889fc71cfa8d1d1fce701a274740477aeef162c2b636a65bd62","evidence":{"acceptance_sequence":"0","checkpoint":{"checkpoint_revision":"1","execution_checkpoint_digest":"sha256:9c466cd1fe4f0ead8151223fc33d7857562e20fbec40c18d9bb2f3b814b07b3a","root_instance_id":"server-1"},"envelope_digest":"sha256:090d185fdbd7c983105c96e8b5b3577dfdb6411e19e4bb3fe599f8e5dee0b848","operation_kind":"acceptance","receipt_sequence":"1"},"source_content_digest":"sha256:cb15ec2440b30586457441b0063e75d398569baaef6e116795d4e55065ed1002","source_delivery_id":"sha256:6b26c4b86994eafbce3d764c8468ded9af0595de8119a6ba140605cf8480abf1","source_scope":"effect-scope-1"}],"checkpoint":"after-timer-checkpoint-v1.json","dead_letters":[],"provider_dispatches":0,"source_acknowledgements":[]},"expected_response":{"acknowledge_source":true,"admission_binding_digest":"sha256:0acd3e2dc158c89de9ed8c4c004ec06e479b923fed31ac797cb1aaa0beb0869c","decision_authority":{"identifier":"orders-host","kind":"host_profile"},"delivery_message_kind":"admitted","event_id":"sha256:b123d06f368bd889fc71cfa8d1d1fce701a274740477aeef162c2b636a65bd62","evidence":{"acceptance_sequence":"0","checkpoint":{"checkpoint_revision":"1","execution_checkpoint_digest":"sha256:9c466cd1fe4f0ead8151223fc33d7857562e20fbec40c18d9bb2f3b814b07b3a","root_instance_id":"server-1"},"envelope_digest":"sha256:090d185fdbd7c983105c96e8b5b3577dfdb6411e19e4bb3fe599f8e5dee0b848","operation_kind":"acceptance","receipt_sequence":"1"},"retention":{"minimum_replay_until":null,"profile":"permanent"},"source_content_digest":"sha256:cb15ec2440b30586457441b0063e75d398569baaef6e116795d4e55065ed1002","source_delivery_id":"sha256:6b26c4b86994eafbce3d764c8468ded9af0595de8119a6ba140605cf8480abf1","source_scope":"effect-scope-1"},"fault_injection":null,"name":"timer_replay_after_commit_crash","operation":"ingest","replay_of":"timer_crash_after_commit_before_ack","request":{"delivery_message_kind":"ingress_request","delivery_mode":"input","envelope":{"cause_id":"sha256:b123d06f368bd889fc71cfa8d1d1fce701a274740477aeef